{
  "schema": "teistro-conformance/baseline-shadbala/1",
  "fixture": "charts/c008-delhi-1947-08-15.json",
  "provenance": {
    "source": "baseline-engine",
    "evidence_rank": 2,
    "engine_version": "1.8.0",
    "exporter_version": "1.0.0",
    "inputs": "the fixture's positions.bodies (longitude, speed, house, sign), vargas D1 D2 D3 D7 D9 D12 D30, foundation (jd, day or night, weekday, sunrise, sunset, next sunrise, ayanamsha, hora and abda lords, lagna) and houses.selected (system, kendra cusps)"
  },
  "inputs": {
    "grahas": {
      "SUN": {
        "longitude_deg": 117.98924087257285,
        "speed_deg_per_day": 0.9735415265765823,
        "house": 3,
        "sign_index": 3,
        "degrees_in_sign": 27.98924087257285
      },
      "MOON": {
        "longitude_deg": 94.39523411782112,
        "speed_deg_per_day": 20.027774582160873,
        "house": 3,
        "sign_index": 3,
        "degrees_in_sign": 4.39523411782112
      },
      "MARS": {
        "longitude_deg": 67.45699797698636,
        "speed_deg_per_day": 0.6629303391036956,
        "house": 2,
        "sign_index": 2,
        "degrees_in_sign": 7.45699797698636
      },
      "MERCURY": {
        "longitude_deg": 103.67483355184666,
        "speed_deg_per_day": 1.8158718474836633,
        "house": 3,
        "sign_index": 3,
        "degrees_in_sign": 13.67483355184666
      },
      "JUPITER": {
        "longitude_deg": 205.87736029155903,
        "speed_deg_per_day": 0.08469156753676543,
        "house": 6,
        "sign_index": 6,
        "degrees_in_sign": 25.87736029155903
      },
      "VENUS": {
        "longitude_deg": 112.56139292399709,
        "speed_deg_per_day": 1.2425680007766005,
        "house": 3,
        "sign_index": 3,
        "degrees_in_sign": 22.56139292399709
      },
      "SATURN": {
        "longitude_deg": 110.47302852435605,
        "speed_deg_per_day": 0.12913249285873007,
        "house": 3,
        "sign_index": 3,
        "degrees_in_sign": 20.47302852435605
      }
    },
    "varga_sign_index": {
      "D1": {
        "SUN": 3,
        "MOON": 3,
        "MARS": 2,
        "MERCURY": 3,
        "JUPITER": 6,
        "VENUS": 3,
        "SATURN": 3
      },
      "D2": {
        "SUN": 4,
        "MOON": 3,
        "MARS": 4,
        "MERCURY": 3,
        "JUPITER": 3,
        "VENUS": 4,
        "SATURN": 4
      },
      "D3": {
        "SUN": 11,
        "MOON": 3,
        "MARS": 2,
        "MERCURY": 7,
        "JUPITER": 2,
        "VENUS": 11,
        "SATURN": 11
      },
      "D7": {
        "SUN": 3,
        "MOON": 10,
        "MARS": 3,
        "MERCURY": 0,
        "JUPITER": 0,
        "VENUS": 2,
        "SATURN": 1
      },
      "D9": {
        "SUN": 11,
        "MOON": 4,
        "MARS": 8,
        "MERCURY": 7,
        "JUPITER": 1,
        "VENUS": 9,
        "SATURN": 9
      },
      "D12": {
        "SUN": 2,
        "MOON": 4,
        "MARS": 4,
        "MERCURY": 8,
        "JUPITER": 4,
        "VENUS": 0,
        "SATURN": 11
      },
      "D30": {
        "SUN": 7,
        "MOON": 1,
        "MARS": 10,
        "MERCURY": 11,
        "JUPITER": 6,
        "VENUS": 9,
        "SATURN": 9
      }
    },
    "jd_ut": 2432412.2708333335,
    "is_day_birth": false,
    "weekday_swe": 3,
    "sunrise_jd": 2432412.513640961,
    "sunset_jd": 2432413.0634846706,
    "next_sunrise_jd": 2432413.5140206823,
    "ayanamsha_deg": 23.12182142181719,
    "hora_lord": "VENUS",
    "abda_lord": "SUN",
    "lagna_longitude_deg": 37.73227002311444,
    "house_system": "whole-sign",
    "kendra_cusps_deg": null
  },
  "shadbala": {
    "SUN": {
      "sthana": {
        "uccha": 24.00358637580905,
        "saptavargiya": 112.5,
        "ojayugma": 0,
        "kendra": 15,
        "drekkana": 0,
        "total": 151.50358637580905
      },
      "dig": 3.247676383513863,
      "kaala": {
        "nathonnatha": 0,
        "paksha": 52.13533108174943,
        "tribhaga": 0,
        "abda": 15,
        "masa": 0,
        "vara": 0,
        "hora": 0,
        "ayana": 0,
        "total": 67.13533108174943
      },
      "cheshta": 48.509319350569704,
      "naisargika": 60,
      "drik": 15,
      "total_shashtiamshas": 345.395913191642,
      "total_rupas": 5.756598553194034,
      "minimum_rupas": 5,
      "is_sufficient": true
    },
    "MOON": {
      "sthana": {
        "uccha": 39.534921960726294,
        "saptavargiya": 172.5,
        "ojayugma": 15,
        "kendra": 15,
        "drekkana": 0,
        "total": 242.0349219607263
      },
      "dig": 48.88765469823556,
      "kaala": {
        "nathonnatha": 0,
        "paksha": 15.729337836501143,
        "tribhaga": 0,
        "abda": 0,
        "masa": 30,
        "vara": 0,
        "hora": 0,
        "ayana": 3.5606488124195312,
        "total": 49.289986648920674
      },
      "cheshta": 7.8646689182505725,
      "naisargika": 51.43,
      "drik": 15,
      "total_shashtiamshas": 414.5072322261331,
      "total_rupas": 6.908453870435552,
      "minimum_rupas": 6,
      "is_sufficient": true
    },
    "MARS": {
      "sthana": {
        "uccha": 16.84766734100454,
        "saptavargiya": 60,
        "ojayugma": 30,
        "kendra": 30,
        "drekkana": 15,
        "total": 151.84766734100452
      },
      "dig": 20.09175734870936,
      "kaala": {
        "nathonnatha": 0,
        "paksha": 52.13533108174943,
        "tribhaga": 0,
        "abda": 0,
        "masa": 0,
        "vara": 0,
        "hora": 0,
        "ayana": 59.99837764157189,
        "total": 112.13370872332132
      },
      "cheshta": 27.66433714868427,
      "naisargika": 17.14,
      "drik": 60,
      "total_shashtiamshas": 388.87747056171946,
      "total_rupas": 6.481291176028658,
      "minimum_rupas": 5,
      "is_sufficient": true
    },
    "MERCURY": {
      "sthana": {
        "uccha": 39.55827785061555,
        "saptavargiya": 37.5,
        "ojayugma": 0,
        "kendra": 15,
        "drekkana": 0,
        "total": 92.05827785061555
      },
      "dig": 38.019145490422595,
      "kaala": {
        "nathonnatha": 60,
        "paksha": 7.864668918250572,
        "tribhaga": 0,
        "abda": 0,
        "masa": 0,
        "vara": 0,
        "hora": 0,
        "ayana": 53.77269921875337,
        "total": 121.63736813700393
      },
      "cheshta": 9.097429789786114,
      "naisargika": 25.71,
      "drik": 15,
      "total_shashtiamshas": 301.5222212678282,
      "total_rupas": 5.025370354463803,
      "minimum_rupas": 7,
      "is_sufficient": false
    },
    "JUPITER": {
      "sthana": {
        "uccha": 23.040879902813657,
        "saptavargiya": 90,
        "ojayugma": 15,
        "kendra": 15,
        "drekkana": 0,
        "total": 143.04087990281366
      },
      "dig": 3.9516365771851363,
      "kaala": {
        "nathonnatha": 0,
        "paksha": 7.864668918250572,
        "tribhaga": 60,
        "abda": 0,
        "masa": 0,
        "vara": 45,
        "hora": 0,
        "ayana": 7.640408038851499,
        "total": 120.50507695710208
      },
      "cheshta": 31.399383334288682,
      "naisargika": 34.29,
      "drik": -60,
      "total_shashtiamshas": 273.1869767713896,
      "total_rupas": 4.55311627952316,
      "minimum_rupas": 6.5,
      "is_sufficient": false
    },
    "VENUS": {
      "sthana": {
        "uccha": 21.47953569200097,
        "saptavargiya": 105,
        "ojayugma": 30,
        "kendra": 15,
        "drekkana": 0,
        "total": 171.47953569200098
      },
      "dig": 54.943040966960886,
      "kaala": {
        "nathonnatha": 0,
        "paksha": 7.864668918250572,
        "tribhaga": 0,
        "abda": 0,
        "masa": 0,
        "vara": 0,
        "hora": 60,
        "ayana": 50.6508802576354,
        "total": 118.51554917588598
      },
      "cheshta": 1.4247615150691786,
      "naisargika": 42.86,
      "drik": 15,
      "total_shashtiamshas": 404.222887349917,
      "total_rupas": 6.737048122498617,
      "minimum_rupas": 5.5,
      "is_sufficient": true
    },
    "SATURN": {
      "sthana": {
        "uccha": 30.15767617478535,
        "saptavargiya": 97.5,
        "ojayugma": 0,
        "kendra": 15,
        "drekkana": 15,
        "total": 157.65767617478537
      },
      "dig": 24.24691950041387,
      "kaala": {
        "nathonnatha": 0,
        "paksha": 52.13533108174943,
        "tribhaga": 0,
        "abda": 0,
        "masa": 0,
        "vara": 0,
        "hora": 0,
        "ayana": 8.570260733091073,
        "total": 60.7055918148405
      },
      "cheshta": 3.8432138699686598,
      "naisargika": 8.57,
      "drik": 15,
      "total_shashtiamshas": 270.0234013600084,
      "total_rupas": 4.5003900226668065,
      "minimum_rupas": 5,
      "is_sufficient": false
    }
  }
}
